{
  "schema_version": "1.0",
  "program_id": "AE-SQ4",
  "corpus_id": "AE-SQ4-AQ-FRESH-V1",
  "split_id": "B",
  "split_nonce": "8e841bf1198c9a0cc9edb2e86d97f553afd5fbec35823478e73536a932b3242c",
  "author_id": "sq4-author-b",
  "authority": {
    "program_id": "AE-SQ4",
    "candidate_id": "AE-SQ4-SLEC-4",
    "candidate_commit": "6357b87cfae9e488bbb1489541ec03d577803463",
    "candidate_tree": "6a04e5aa846cbe196425c58671bf390c499b4d59",
    "f1_freeze_sha256": "580b08484a5ae9f35a942d1063ba7ce82ca83521533b0f8e0e6f763187f83893",
    "corpus_contract_sha256": "6a396d1fec60270c1175968ef47766bee8576fe650f139491a337e6f4f3bd724",
    "gates_sha256": "dc6056c0dc8fcc16b4208a9639a3932f4ea644f45cb311751c3a6c879390c537",
    "metrics_sha256": "1ca000132e2ed57f0ac979e6f098d2ec10772421a6d3794639f79bd5cc45e081",
    "evaluator_schema_sha256": "8d01d29156983441554ff8772be1d7493542e360edeeb65fe2305e0183feedf4"
  },
  "no_replay": {
    "normalization_id": "ae-sq4-task-v1",
    "historical_digest_inventory_sha256": "0e49a967d9a59021c0f1aa5fc8d80fd53fdf3ab1885925b0d86f1e8c4f9dc157",
    "historical_inventory_content_sha256": "8ee69ae06f388c1b47386b312d31bcce7ae408d04e76659653335d55e12ac270",
    "historical_inventory_count": 768,
    "historical_text_embedded": false,
    "predecessor_case_label_or_result_material_embedded": false
  },
  "cases": [
    {
      "case_id": "AE-SQ4-B-01",
      "case_nonce": "f9775fc7e7074c2cf43457742bd5dbf0f500b9a28b941718f090ddb3aa8f00d1",
      "task_text": "Return the four identifiers amber, cobalt, ivory, and teal in alphabetical order, one per line, without commentary.",
      "task_text_nfc_sha256": "43aa3b2e137647fd184519492f874a26167be8d4a4989ced8290a5a7da9dcb6a",
      "profile": "none",
      "explicit_slot_id": null,
      "expected_capsules": [
        {
          "slot_id": "s0",
          "local_need": "no",
          "reference_need": "none",
          "anchors": [
            {
              "start": 0,
              "end": 27,
              "text": "Return the four identifiers"
            }
          ]
        },
        {
          "slot_id": "s1",
          "local_need": "no",
          "reference_need": "none",
          "anchors": [
            {
              "start": 0,
              "end": 27,
              "text": "Return the four identifiers"
            }
          ]
        },
        {
          "slot_id": "s2",
          "local_need": "no",
          "reference_need": "none",
          "anchors": [
            {
              "start": 0,
              "end": 27,
              "text": "Return the four identifiers"
            }
          ]
        },
        {
          "slot_id": "s3",
          "local_need": "no",
          "reference_need": "none",
          "anchors": [
            {
              "start": 0,
              "end": 27,
              "text": "Return the four identifiers"
            }
          ]
        }
      ],
      "expected_resolution": {
        "status": "none",
        "selected_slots": [],
        "reference_bundle": []
      }
    },
    {
      "case_id": "AE-SQ4-B-02",
      "case_nonce": "3330107660d5f080058920e932321362106ce45eb3eb0c9dd3f43fcb184c1472",
      "task_text": "Replace each written marker <TAB> in the supplied string with two spaces and preserve every other character exactly: alpha<TAB>beta<TAB>gamma.",
      "task_text_nfc_sha256": "ccab1bd1674c5c5f2753d022f83ea16f2e2bcfd5f80c72e7e519feed97867cf9",
      "profile": "none",
      "explicit_slot_id": null,
      "expected_capsules": [
        {
          "slot_id": "s0",
          "local_need": "no",
          "reference_need": "none",
          "anchors": [
            {
              "start": 0,
              "end": 27,
              "text": "Replace each written marker"
            }
          ]
        },
        {
          "slot_id": "s1",
          "local_need": "no",
          "reference_need": "none",
          "anchors": [
            {
              "start": 0,
              "end": 27,
              "text": "Replace each written marker"
            }
          ]
        },
        {
          "slot_id": "s2",
          "local_need": "no",
          "reference_need": "none",
          "anchors": [
            {
              "start": 0,
              "end": 27,
              "text": "Replace each written marker"
            }
          ]
        },
        {
          "slot_id": "s3",
          "local_need": "no",
          "reference_need": "none",
          "anchors": [
            {
              "start": 0,
              "end": 27,
              "text": "Replace each written marker"
            }
          ]
        }
      ],
      "expected_resolution": {
        "status": "none",
        "selected_slots": [],
        "reference_bundle": []
      }
    },
    {
      "case_id": "AE-SQ4-B-03",
      "case_nonce": "2e5e959075b4f9337f5cbc15fb992f23dc130c29fecd55506ecb14829707f4b2",
      "task_text": "Rewrite the sentence 'The build finished quickly' in the past perfect tense and output only the rewritten sentence.",
      "task_text_nfc_sha256": "e3440175863c43f3bf9023608dd654030969fc57f06e331883e4449446bd5bd6",
      "profile": "none",
      "explicit_slot_id": null,
      "expected_capsules": [
        {
          "slot_id": "s0",
          "local_need": "no",
          "reference_need": "none",
          "anchors": [
            {
              "start": 0,
              "end": 20,
              "text": "Rewrite the sentence"
            }
          ]
        },
        {
          "slot_id": "s1",
          "local_need": "no",
          "reference_need": "none",
          "anchors": [
            {
              "start": 0,
              "end": 20,
              "text": "Rewrite the sentence"
            }
          ]
        },
        {
          "slot_id": "s2",
          "local_need": "no",
          "reference_need": "none",
          "anchors": [
            {
              "start": 0,
              "end": 20,
              "text": "Rewrite the sentence"
            }
          ]
        },
        {
          "slot_id": "s3",
          "local_need": "no",
          "reference_need": "none",
          "anchors": [
            {
              "start": 0,
              "end": 20,
              "text": "Rewrite the sentence"
            }
          ]
        }
      ],
      "expected_resolution": {
        "status": "none",
        "selected_slots": [],
        "reference_bundle": []
      }
    },
    {
      "case_id": "AE-SQ4-B-04",
      "case_nonce": "d7ecad79098e25ce1fd8f16d716039ca07e1eefb5ac7a9b59c99682cb2861f42",
      "task_text": "Design the control-plane topology for an agent service that delegates to two workers, must survive coordinator restart, and must prevent duplicate side effects. Place durable state, idempotency, and human approval boundaries.",
      "task_text_nfc_sha256": "e2c2ebb67b03ec4f9aee663d3e1a69c4e65f07a3f74d1885f2522c7f5c39c2fe",
      "profile": "single",
      "explicit_slot_id": null,
      "expected_capsules": [
        {
          "slot_id": "s0",
          "local_need": "yes",
          "reference_need": "core",
          "anchors": [
            {
              "start": 11,
              "end": 33,
              "text": "control-plane topology"
            }
          ]
        },
        {
          "slot_id": "s1",
          "local_need": "no",
          "reference_need": "none",
          "anchors": [
            {
              "start": 60,
              "end": 84,
              "text": "delegates to two workers"
            }
          ]
        },
        {
          "slot_id": "s2",
          "local_need": "no",
          "reference_need": "none",
          "anchors": [
            {
              "start": 60,
              "end": 84,
              "text": "delegates to two workers"
            }
          ]
        },
        {
          "slot_id": "s3",
          "local_need": "no",
          "reference_need": "none",
          "anchors": [
            {
              "start": 60,
              "end": 84,
              "text": "delegates to two workers"
            }
          ]
        }
      ],
      "expected_resolution": {
        "status": "selected",
        "selected_slots": [
          "s0"
        ],
        "reference_bundle": [
          {
            "slot_id": "s0",
            "need": "core"
          }
        ]
      }
    },
    {
      "case_id": "AE-SQ4-B-05",
      "case_nonce": "23808ed2130638cf31b89d3112c857ff65d74e1f5aa40a7441f14f8632d596fc",
      "task_text": "Choose whether a single loop, supervisor-worker graph, or event-driven state machine should coordinate a document triage agent with resumable jobs and bounded retries; justify where recovery state belongs.",
      "task_text_nfc_sha256": "86b0cbc9cd46e8550a53943c277a2d1376d62be6a7d7df2a09c95a5795334af9",
      "profile": "single",
      "explicit_slot_id": null,
      "expected_capsules": [
        {
          "slot_id": "s0",
          "local_need": "yes",
          "reference_need": "focused",
          "anchors": [
            {
              "start": 30,
              "end": 53,
              "text": "supervisor-worker graph"
            }
          ]
        },
        {
          "slot_id": "s1",
          "local_need": "no",
          "reference_need": "none",
          "anchors": [
            {
              "start": 105,
              "end": 126,
              "text": "document triage agent"
            }
          ]
        },
        {
          "slot_id": "s2",
          "local_need": "no",
          "reference_need": "none",
          "anchors": [
            {
              "start": 105,
              "end": 126,
              "text": "document triage agent"
            }
          ]
        },
        {
          "slot_id": "s3",
          "local_need": "no",
          "reference_need": "none",
          "anchors": [
            {
              "start": 105,
              "end": 126,